{
    "certsdp_report_version": "3.0",
    "accepted": true,
    "gate": "D",
    "family": "chordal_psd",
    "stage": "chordal_replay",
    "reason": "accepted",
    "obligation_id": "chordal_psd",
    "problem_hash": "sha256:14fb1d284fadfe2d6e3e97f3a13367d0434fce0ff5ac67177ed3950f4527dd46",
    "certificate_hash": "sha256:29dc001d5ab045e60026ef551adced588ae5d2efbd9ff56fdffaaedc868e0c12",
    "block_id": null,
    "clique_id": null,
    "separator_id": null,
    "artifact_path": null,
    "details": {
    }
}
