{
    "certsdp_report_version": "3.0",
    "accepted": true,
    "gate": "H",
    "family": "sparse_sos",
    "stage": "coefficient_matching",
    "reason": "accepted",
    "obligation_id": "polynomial_identity",
    "problem_hash": "sha256:d0afc08c9704e6713bb5e6b911b074d8713101bac4e65f0377c8294f09ba87e9",
    "certificate_hash": "sha256:28d6063b6d01c95306c93e8729bd398013167c3a54fa0081ff7a6c8706f4ce76",
    "block_id": null,
    "clique_id": null,
    "separator_id": null,
    "artifact_path": "test/fixtures_real/tssos/normalized_certificate.json",
    "details": {
    }
}
