{
    "certsdp_report_version": "3.0",
    "accepted": true,
    "gate": "J",
    "family": "quantum_bound",
    "stage": "objective_bound",
    "reason": "accepted",
    "obligation_id": "exact_bound",
    "problem_hash": "sha256:8e28c1fc091699b98a89a7b4df15ec1ec7a990e7544f7e429e196ebeee5d2e00",
    "certificate_hash": "sha256:af08afa299d3604df018759dccb9654a0802e6ff9f0c93e935b09d718d4de4a2",
    "block_id": null,
    "clique_id": null,
    "separator_id": null,
    "artifact_path": "test/fixtures_real/nctssos/normalized_certificate.json",
    "details": {
    }
}
